{
  "contract_version": "1.0",
  "id": "ore-grade-regressor",
  "alias": "champion",
  "version": "0.2.0",
  "io_contract": "contracts/C31-grade-io.schema.json",
  "status": "training",
  "baseline": {
    "kind": "constant",
    "description": "returns the historical mean grade"
  },
  "metrics": {
    "mae": 0.42
  },
  "data_card": "data/cards/grade.md",
  "training_run": "run-0002",
  "serving": {
    "answered_by": "baseline",
    "alias": "champion"
  }
}
